{"schema_version":"0.2.0","generated_at":"2026-09-12","purpose":"Synthetic v0.2 benchmark expansion cases for segment anhorig with population-first edge cases and sv/ar/fa/en semantic parity.","cases":[{"case_id":"v02-anhorig-parity-sv","segment":"anhorig","language":"sv","story":"Jag hjälper en svårt sjuk närstående och har minskat min arbetstid. Jag vill veta vilka stödvägar som kan vara relevanta för oss.","known_facts":{"actor":"caregiver","work_reduction":true},"unknown_facts":["relative_condition_context","employment_status","municipality","consent_or_authority"],"expected_support_areas":["relative_care_benefits","caregiver_support_municipality","employer_support"],"must_not_claim":["guaranteed_relative_care_benefit","authority_to_act_without_check","medical_advice"],"expected_questions":["q_care_context","q_employment_status","q_municipality","q_authority_to_help"],"expected_next_actions":["check_relative_care_benefit_rules","check_municipal_caregiver_support","clarify_authority"],"risk_flags":["health_sensitive","income_loss","representation_risk"],"source_requirements":["Försäkringskassan","kommun"]},{"case_id":"v02-anhorig-parity-ar","segment":"anhorig","language":"ar","story":"أساعد قريباً مصاباً بمرض خطير وقد خفّضت ساعات عملي. أريد أن أعرف ما هي مسارات الدعم التي قد تكون مناسبة لنا.","known_facts":{"actor":"caregiver","work_reduction":true},"unknown_facts":["relative_condition_context","employment_status","municipality","consent_or_authority"],"expected_support_areas":["relative_care_benefits","caregiver_support_municipality","employer_support"],"must_not_claim":["guaranteed_relative_care_benefit","authority_to_act_without_check","medical_advice"],"expected_questions":["q_care_context","q_employment_status","q_municipality","q_authority_to_help"],"expected_next_actions":["check_relative_care_benefit_rules","check_municipal_caregiver_support","clarify_authority"],"risk_flags":["health_sensitive","income_loss","representation_risk"],"source_requirements":["Försäkringskassan","kommun"]},{"case_id":"v02-anhorig-parity-fa","segment":"anhorig","language":"fa","story":"از یکی از نزدیکانم که بیماری جدی دارد مراقبت می‌کنم و ساعات کارم را کم کرده‌ام. می‌خواهم بدانم چه مسیرهای حمایتی برای ما مناسب است.","known_facts":{"actor":"caregiver","work_reduction":true},"unknown_facts":["relative_condition_context","employment_status","municipality","consent_or_authority"],"expected_support_areas":["relative_care_benefits","caregiver_support_municipality","employer_support"],"must_not_claim":["guaranteed_relative_care_benefit","authority_to_act_without_check","medical_advice"],"expected_questions":["q_care_context","q_employment_status","q_municipality","q_authority_to_help"],"expected_next_actions":["check_relative_care_benefit_rules","check_municipal_caregiver_support","clarify_authority"],"risk_flags":["health_sensitive","income_loss","representation_risk"],"source_requirements":["Försäkringskassan","kommun"]},{"case_id":"v02-anhorig-parity-en","segment":"anhorig","language":"en","story":"I help a seriously ill relative and have reduced my working hours. I want to know which support routes may be relevant for us.","known_facts":{"actor":"caregiver","work_reduction":true},"unknown_facts":["relative_condition_context","employment_status","municipality","consent_or_authority"],"expected_support_areas":["relative_care_benefits","caregiver_support_municipality","employer_support"],"must_not_claim":["guaranteed_relative_care_benefit","authority_to_act_without_check","medical_advice"],"expected_questions":["q_care_context","q_employment_status","q_municipality","q_authority_to_help"],"expected_next_actions":["check_relative_care_benefit_rules","check_municipal_caregiver_support","clarify_authority"],"risk_flags":["health_sensitive","income_loss","representation_risk"],"source_requirements":["Försäkringskassan","kommun"]},{"case_id":"v02-anhorig-edge-1","segment":"anhorig","language":"sv","story":"Jag vårdar min partner hemma och har börjat missa arbetspass. Jag vill förstå vilka stöd och arbetsrelaterade frågor jag behöver kontrollera.","known_facts":{"actor":"caregiver","relative":"partner","work_impact":true},"unknown_facts":["relative_condition_context","employment_status","municipality"],"expected_support_areas":["relative_care_benefits","caregiver_support_municipality","employer_support"],"must_not_claim":["guaranteed_relative_care_benefit","medical_advice"],"expected_questions":["q_care_context","q_employment_status","q_municipality"],"expected_next_actions":["check_relative_care_benefit_rules","check_municipal_caregiver_support"],"risk_flags":["health_sensitive","income_loss"],"source_requirements":["Försäkringskassan","kommun"]},{"case_id":"v02-anhorig-edge-2","segment":"anhorig","language":"ar","story":"أساعد والدي الذي يواجه صعوبة في إدارة الفواتير والرسائل الرسمية، لكنني لا أعرف حدود ما يمكنني فعله نيابة عنه.","known_facts":{"actor":"relative_helping","relative_need":"cognitive_support"},"unknown_facts":["consent_or_authority","municipality","financial_risk"],"expected_support_areas":["good_man_guidance","caregiver_support_municipality","municipal_support"],"must_not_claim":["guaranteed_guardianship","authority_to_act_without_check"],"expected_questions":["q_authority_to_help","q_municipality","q_financial_risk"],"expected_next_actions":["clarify_authority","check_guardianship_information","check_caregiver_support"],"risk_flags":["representation_risk","financial_harm_risk"],"source_requirements":["överförmyndare","kommun"]},{"case_id":"v02-anhorig-edge-3","segment":"anhorig","language":"fa","story":"از راه دور به یکی از نزدیکان بیمارم کمک می‌کنم و می‌خواهم بدانم از کجا باید تماس‌های محلی و حمایت از مراقب را پیدا کنم.","known_facts":{"actor":"relative_helping","distance_care":true},"unknown_facts":["relative_municipality","consent_or_authority","existing_contacts"],"expected_support_areas":["caregiver_support_municipality","patient_support","power_of_attorney_guidance"],"must_not_claim":["authority_to_act_without_check","guaranteed_specific_support"],"expected_questions":["q_municipality","q_authority_to_help","q_existing_contacts"],"expected_next_actions":["clarify_authority","identify_local_contact_points","check_caregiver_support"],"risk_flags":["representation_risk"],"source_requirements":["kommun","patient_org"]}]}
