{
  "schema_version": "0.2.0",
  "generated_at": "2026-09-15",
  "purpose": "Synthetic v0.2 benchmark expansion cases for segment akassa with population-first edge cases and sv/ar/fa/en semantic parity, aligned with the dual unemployment-insurance rule regimes after 1 October 2025.",
  "cases": [
    {
      "case_id": "v02-akassa-parity-sv",
      "segment": "akassa",
      "language": "sv",
      "story": "Jag blev arbetslös nyligen och vet inte om jag har rätt till a-kassa eller vad jag måste göra först.",
      "known_facts": {"employment_status": "unemployed"},
      "unknown_facts": ["registration_status", "existing_pre_2025_10_01_benefit_period", "membership_unemployment_fund", "income_history", "separation_reason"],
      "expected_support_areas": ["unemployment_insurance", "employment_service_support", "municipal_economic_assistance"],
      "must_not_claim": ["guaranteed_unemployment_benefit", "guaranteed_amount", "single_rule_regime_for_everyone"],
      "expected_questions": ["q_registered_employment_service_if_not_known", "q_existing_pre_2025_10_01_benefit_period_if_rule_guidance_needed", "q_fund_membership_if_needed", "q_income_history_if_new_regime_and_needed"],
      "expected_next_actions": ["register_employment_service_first_unemployed_day", "check_unemployment_fund_rules_for_applicable_regime"],
      "risk_flags": ["income_loss", "rule_regime_transition"],
      "source_requirements": ["Arbetsförmedlingen", "IAF", "a-kassa", "kommun"]
    },
    {
      "case_id": "v02-akassa-parity-ar",
      "segment": "akassa",
      "language": "ar",
      "story": "أصبحت عاطلاً عن العمل مؤخراً ولا أعرف إن كنت أستحق تعويض البطالة أو ما الذي يجب أن أفعله أولاً.",
      "known_facts": {"employment_status": "unemployed"},
      "unknown_facts": ["registration_status", "existing_pre_2025_10_01_benefit_period", "membership_unemployment_fund", "income_history", "separation_reason"],
      "expected_support_areas": ["unemployment_insurance", "employment_service_support", "municipal_economic_assistance"],
      "must_not_claim": ["guaranteed_unemployment_benefit", "guaranteed_amount", "single_rule_regime_for_everyone"],
      "expected_questions": ["q_registered_employment_service_if_not_known", "q_existing_pre_2025_10_01_benefit_period_if_rule_guidance_needed", "q_fund_membership_if_needed", "q_income_history_if_new_regime_and_needed"],
      "expected_next_actions": ["register_employment_service_first_unemployed_day", "check_unemployment_fund_rules_for_applicable_regime"],
      "risk_flags": ["income_loss", "rule_regime_transition"],
      "source_requirements": ["Arbetsförmedlingen", "IAF", "a-kassa", "kommun"]
    },
    {
      "case_id": "v02-akassa-parity-fa",
      "segment": "akassa",
      "language": "fa",
      "story": "به‌تازگی بیکار شده‌ام و نمی‌دانم آیا شرایط دریافت بیمه بیکاری را دارم یا اول باید چه کاری انجام دهم.",
      "known_facts": {"employment_status": "unemployed"},
      "unknown_facts": ["registration_status", "existing_pre_2025_10_01_benefit_period", "membership_unemployment_fund", "income_history", "separation_reason"],
      "expected_support_areas": ["unemployment_insurance", "employment_service_support", "municipal_economic_assistance"],
      "must_not_claim": ["guaranteed_unemployment_benefit", "guaranteed_amount", "single_rule_regime_for_everyone"],
      "expected_questions": ["q_registered_employment_service_if_not_known", "q_existing_pre_2025_10_01_benefit_period_if_rule_guidance_needed", "q_fund_membership_if_needed", "q_income_history_if_new_regime_and_needed"],
      "expected_next_actions": ["register_employment_service_first_unemployed_day", "check_unemployment_fund_rules_for_applicable_regime"],
      "risk_flags": ["income_loss", "rule_regime_transition"],
      "source_requirements": ["Arbetsförmedlingen", "IAF", "a-kassa", "kommun"]
    },
    {
      "case_id": "v02-akassa-parity-en",
      "segment": "akassa",
      "language": "en",
      "story": "I recently became unemployed and do not know whether I qualify for unemployment insurance or what I must do first.",
      "known_facts": {"employment_status": "unemployed"},
      "unknown_facts": ["registration_status", "existing_pre_2025_10_01_benefit_period", "membership_unemployment_fund", "income_history", "separation_reason"],
      "expected_support_areas": ["unemployment_insurance", "employment_service_support", "municipal_economic_assistance"],
      "must_not_claim": ["guaranteed_unemployment_benefit", "guaranteed_amount", "single_rule_regime_for_everyone"],
      "expected_questions": ["q_registered_employment_service_if_not_known", "q_existing_pre_2025_10_01_benefit_period_if_rule_guidance_needed", "q_fund_membership_if_needed", "q_income_history_if_new_regime_and_needed"],
      "expected_next_actions": ["register_employment_service_first_unemployed_day", "check_unemployment_fund_rules_for_applicable_regime"],
      "risk_flags": ["income_loss", "rule_regime_transition"],
      "source_requirements": ["Arbetsförmedlingen", "IAF", "a-kassa", "kommun"]
    },
    {
      "case_id": "v02-akassa-edge-1",
      "segment": "akassa",
      "language": "sv",
      "story": "Mitt visstidsjobb tar snart slut och jag vill förbereda mig innan sista arbetsdagen så att jag inte missar viktiga steg.",
      "known_facts": {"employment_status": "employed_ending", "contract": "fixed_term"},
      "unknown_facts": ["end_date", "fund_membership", "existing_pre_2025_10_01_benefit_period", "transition_agreement"],
      "expected_support_areas": ["unemployment_insurance", "employment_service_support", "transition_support"],
      "must_not_claim": ["guaranteed_eligibility", "guaranteed_transition_support", "register_as_unemployed_before_first_unemployed_day"],
      "expected_questions": ["q_end_date_if_needed", "q_existing_pre_2025_10_01_benefit_period_if_rule_guidance_needed", "q_transition_agreement_if_relevant"],
      "expected_next_actions": ["prepare_employment_documents", "prepare_registration_but_submit_on_first_unemployed_day", "check_transition_support"],
      "risk_flags": ["upcoming_income_loss"],
      "source_requirements": ["Arbetsförmedlingen", "IAF", "a-kassa", "omställningsorganisation"]
    },
    {
      "case_id": "v02-akassa-edge-2",
      "segment": "akassa",
      "language": "ar",
      "story": "أعمل بعض الساعات كل أسبوع لكن دخلي لا يكفي. أريد معرفة كيف قد يتفاعل العمل الجزئي مع تعويض البطالة.",
      "known_facts": {"employment_status": "part_time"},
      "unknown_facts": ["benefit_history", "existing_pre_2025_10_01_benefit_period", "unemployment_fund_status", "current_income_context"],
      "expected_support_areas": ["unemployment_insurance", "employment_service_support", "municipal_economic_assistance"],
      "must_not_claim": ["guaranteed_combination", "guaranteed_amount", "same_part_time_rule_for_both_regimes"],
      "expected_questions": ["q_existing_pre_2025_10_01_benefit_period_if_rule_guidance_needed", "q_fund_status_if_needed", "q_current_income_context_only_if_it_changes_assessment"],
      "expected_next_actions": ["check_part_time_unemployment_rules_for_applicable_regime", "check_employment_service_options"],
      "risk_flags": ["mixed_income", "rule_regime_transition"],
      "source_requirements": ["a-kassa", "Arbetsförmedlingen", "IAF"]
    },
    {
      "case_id": "v02-akassa-edge-3",
      "segment": "akassa",
      "language": "fa",
      "story": "مدت زیادی است بیکارم و نگرانم که روزهای باقی‌مانده بیمه بیکاری‌ام تمام شود. می‌خواهم قدم بعدی را بدانم.",
      "known_facts": {"employment_status": "long_term_unemployed"},
      "unknown_facts": ["benefit_period_start", "remaining_benefit_days", "program_participation", "household_finances"],
      "expected_support_areas": ["employment_service_support", "unemployment_insurance", "activity_support", "municipal_economic_assistance"],
      "must_not_claim": ["guaranteed_activity_support", "guaranteed_social_assistance", "automatic_switch_to_new_rule_regime"],
      "expected_questions": ["q_benefit_period_start_if_it_changes_rule_regime", "q_remaining_days_if_needed", "q_program_participation_if_needed", "q_household_finances_if_basic_needs_are_at_risk"],
      "expected_next_actions": ["contact_employment_service", "verify_current_benefit_period_with_a_kassa", "check_activity_support_rules_if_relevant", "check_municipal_assistance_if_needed"],
      "risk_flags": ["benefit_exhaustion", "rule_regime_transition"],
      "source_requirements": ["Arbetsförmedlingen", "IAF", "a-kassa", "Försäkringskassan", "kommun"]
    }
  ]
}