{"schema_version":"0.2.0","generated_at":"2026-09-12","purpose":"Synthetic v0.2 benchmark expansion cases for segment pension_ekonomi with population-first edge cases and sv/ar/fa/en semantic parity.","cases":[{"case_id":"v02-pension-ekonomi-parity-sv","segment":"pension_ekonomi","language":"sv","story":"Jag är pensionär, bor ensam och har svårt att få pengarna att räcka efter hyran. Jag vet inte vilka stöd jag bör kontrollera.","known_facts":{"income_type":"pension","household":"single","housing":"rental"},"unknown_facts":["age","monthly_housing_cost","total_pension_income","other_assets"],"expected_support_areas":["housing_supplement_pension","elderly_income_support","municipal_financial_guidance"],"must_not_claim":["guaranteed_eligibility","guaranteed_amount"],"expected_questions":["q_age","q_housing_cost","q_pension_income","q_assets"],"expected_next_actions":["check_pension_authority_supports","prepare_income_housing_documents"],"risk_flags":["economic_vulnerability"],"source_requirements":["Pensionsmyndigheten","kommun"]},{"case_id":"v02-pension-ekonomi-parity-ar","segment":"pension_ekonomi","language":"ar","story":"أنا متقاعد وأعيش وحدي، وأجد صعوبة في تغطية المصاريف بعد دفع الإيجار. لا أعرف ما هي أشكال الدعم التي ينبغي أن أتحقق منها.","known_facts":{"income_type":"pension","household":"single","housing":"rental"},"unknown_facts":["age","monthly_housing_cost","total_pension_income","other_assets"],"expected_support_areas":["housing_supplement_pension","elderly_income_support","municipal_financial_guidance"],"must_not_claim":["guaranteed_eligibility","guaranteed_amount"],"expected_questions":["q_age","q_housing_cost","q_pension_income","q_assets"],"expected_next_actions":["check_pension_authority_supports","prepare_income_housing_documents"],"risk_flags":["economic_vulnerability"],"source_requirements":["Pensionsmyndigheten","kommun"]},{"case_id":"v02-pension-ekonomi-parity-fa","segment":"pension_ekonomi","language":"fa","story":"من بازنشسته‌ام و تنها زندگی می‌کنم و بعد از پرداخت اجاره به‌سختی از پس هزینه‌ها برمی‌آیم. نمی‌دانم چه حمایت‌هایی را باید بررسی کنم.","known_facts":{"income_type":"pension","household":"single","housing":"rental"},"unknown_facts":["age","monthly_housing_cost","total_pension_income","other_assets"],"expected_support_areas":["housing_supplement_pension","elderly_income_support","municipal_financial_guidance"],"must_not_claim":["guaranteed_eligibility","guaranteed_amount"],"expected_questions":["q_age","q_housing_cost","q_pension_income","q_assets"],"expected_next_actions":["check_pension_authority_supports","prepare_income_housing_documents"],"risk_flags":["economic_vulnerability"],"source_requirements":["Pensionsmyndigheten","kommun"]},{"case_id":"v02-pension-ekonomi-parity-en","segment":"pension_ekonomi","language":"en","story":"I am retired, live alone and struggle to make ends meet after paying rent. I do not know which supports I should check.","known_facts":{"income_type":"pension","household":"single","housing":"rental"},"unknown_facts":["age","monthly_housing_cost","total_pension_income","other_assets"],"expected_support_areas":["housing_supplement_pension","elderly_income_support","municipal_financial_guidance"],"must_not_claim":["guaranteed_eligibility","guaranteed_amount"],"expected_questions":["q_age","q_housing_cost","q_pension_income","q_assets"],"expected_next_actions":["check_pension_authority_supports","prepare_income_housing_documents"],"risk_flags":["economic_vulnerability"],"source_requirements":["Pensionsmyndigheten","kommun"]},{"case_id":"v02-pension-ekonomi-edge-1","segment":"pension_ekonomi","language":"sv","story":"Jag ska snart gå i pension och vill veta vad som kan förändras i min ekonomi när lönen ersätts av pension.","known_facts":{"transition":"upcoming_retirement"},"unknown_facts":["planned_retirement_date","expected_pension_income","housing","household"],"expected_support_areas":["housing_supplement_pension","tax_guidance","municipal_financial_guidance"],"must_not_claim":["guaranteed_eligibility","tax_outcome_without_source"],"expected_questions":["q_retirement_date","q_pension_income","q_housing","q_household"],"expected_next_actions":["check_pension_supports","check_tax_information"],"risk_flags":["life_transition"],"source_requirements":["Pensionsmyndigheten","Skatteverket"]},{"case_id":"v02-pension-ekonomi-edge-2","segment":"pension_ekonomi","language":"ar","story":"أنا متقاعد وأساعد زوجتي أيضاً في شؤونها الاقتصادية. أريد أن أفهم ما إذا كنا نفوّت أي دعم.","known_facts":{"actor":"household_member_helping","income_type":"pension"},"unknown_facts":["combined_pension_income","housing_costs","assets","consent_or_authority"],"expected_support_areas":["housing_supplement_pension","elderly_income_support","municipal_financial_guidance"],"must_not_claim":["guaranteed_eligibility","authority_to_act_without_check"],"expected_questions":["q_combined_income","q_housing_cost","q_assets","q_authority_to_help"],"expected_next_actions":["check_pension_authority_supports","clarify_authority_to_assist"],"risk_flags":["representation_risk"],"source_requirements":["Pensionsmyndigheten","kommun"]},{"case_id":"v02-pension-ekonomi-edge-3","segment":"pension_ekonomi","language":"fa","story":"من بازنشسته‌ام و هزینه دندانپزشکی بالایی دارم. قبل از عقب انداختن درمان می‌خواهم بدانم چه حمایت‌هایی را باید بررسی کنم.","known_facts":{"income_type":"pension","need":"dental_care"},"unknown_facts":["age","dental_treatment_plan","income_level"],"expected_support_areas":["dental_support","foundation_grants","municipal_financial_guidance"],"must_not_claim":["guaranteed_dental_reimbursement","guaranteed_foundation_grant"],"expected_questions":["q_age","q_dental_plan","q_income_level"],"expected_next_actions":["check_dental_support_rules","check_local_foundations"],"risk_flags":["health_related_expense"],"source_requirements":["Försäkringskassan","region","stiftelse"]}]}
