{"schema_version":"0.2.0","generated_at":"2026-09-12","purpose":"Synthetic v0.2 benchmark expansion cases for segment cancer with population-first edge cases and sv/ar/fa/en semantic parity.","cases":[{"case_id":"v02-cancer-parity-sv","segment":"cancer","language":"sv","story":"Jag behandlas för en allvarlig sjukdom och är sjukskriven. Jag behöver förstå ekonomiskt stöd, försäkringar och vilket nästa steg som är viktigast.","known_facts":{"actor":"affected","serious_illness":true,"sick_leave":true},"unknown_facts":["employment_type","benefit_status","insurance_coverage","household"],"expected_support_areas":["sickness_benefit","insurance_compensation","patient_support"],"must_not_claim":["medical_advice","guaranteed_benefit","guaranteed_insurance_compensation"],"expected_questions":["q_employment_type","q_benefit_status","q_insurance","q_household"],"expected_next_actions":["check_sickness_benefit","check_insurances","check_patient_support"],"risk_flags":["health_sensitive","income_loss"],"source_requirements":["Försäkringskassan","insurance","patient_org"]},{"case_id":"v02-cancer-parity-ar","segment":"cancer","language":"ar","story":"أتلقى علاجاً لمرض خطير وأنا في إجازة مرضية. أحتاج إلى فهم الدعم المالي والتأمينات وما هي الخطوة التالية الأكثر أهمية.","known_facts":{"actor":"affected","serious_illness":true,"sick_leave":true},"unknown_facts":["employment_type","benefit_status","insurance_coverage","household"],"expected_support_areas":["sickness_benefit","insurance_compensation","patient_support"],"must_not_claim":["medical_advice","guaranteed_benefit","guaranteed_insurance_compensation"],"expected_questions":["q_employment_type","q_benefit_status","q_insurance","q_household"],"expected_next_actions":["check_sickness_benefit","check_insurances","check_patient_support"],"risk_flags":["health_sensitive","income_loss"],"source_requirements":["Försäkringskassan","insurance","patient_org"]},{"case_id":"v02-cancer-parity-fa","segment":"cancer","language":"fa","story":"برای یک بیماری جدی تحت درمان هستم و مرخصی استعلاجی دارم. می‌خواهم حمایت مالی، بیمه‌ها و مهم‌ترین قدم بعدی را بهتر بفهمم.","known_facts":{"actor":"affected","serious_illness":true,"sick_leave":true},"unknown_facts":["employment_type","benefit_status","insurance_coverage","household"],"expected_support_areas":["sickness_benefit","insurance_compensation","patient_support"],"must_not_claim":["medical_advice","guaranteed_benefit","guaranteed_insurance_compensation"],"expected_questions":["q_employment_type","q_benefit_status","q_insurance","q_household"],"expected_next_actions":["check_sickness_benefit","check_insurances","check_patient_support"],"risk_flags":["health_sensitive","income_loss"],"source_requirements":["Försäkringskassan","insurance","patient_org"]},{"case_id":"v02-cancer-parity-en","segment":"cancer","language":"en","story":"I am being treated for a serious illness and am on sick leave. I need to understand financial support, insurance and the most important next step.","known_facts":{"actor":"affected","serious_illness":true,"sick_leave":true},"unknown_facts":["employment_type","benefit_status","insurance_coverage","household"],"expected_support_areas":["sickness_benefit","insurance_compensation","patient_support"],"must_not_claim":["medical_advice","guaranteed_benefit","guaranteed_insurance_compensation"],"expected_questions":["q_employment_type","q_benefit_status","q_insurance","q_household"],"expected_next_actions":["check_sickness_benefit","check_insurances","check_patient_support"],"risk_flags":["health_sensitive","income_loss"],"source_requirements":["Försäkringskassan","insurance","patient_org"]},{"case_id":"v02-cancer-edge-1","segment":"cancer","language":"sv","story":"Jag behöver resa långt till behandling flera gånger och vill förstå vilka reseersättningar eller andra ekonomiska vägar som kan finnas.","known_facts":{"actor":"affected","treatment_travel":true},"unknown_facts":["region","travel_distance","treatment_provider"],"expected_support_areas":["patient_travel","foundation_grants"],"must_not_claim":["guaranteed_travel_reimbursement","medical_advice"],"expected_questions":["q_region","q_travel_distance","q_provider"],"expected_next_actions":["check_region_patient_travel_rules","check_foundations_if_gap"],"risk_flags":["health_sensitive"],"source_requirements":["region","stiftelse"]},{"case_id":"v02-cancer-edge-2","segment":"cancer","language":"ar","story":"أنهيت علاجاً لمرض خطير وأحاول العودة إلى العمل تدريجياً. أريد معرفة ما الذي يجب تنسيقه قبل تغيير ساعات العمل.","known_facts":{"actor":"affected","return_to_work":true},"unknown_facts":["employment_type","current_work_capacity","rehab_plan"],"expected_support_areas":["work_rehabilitation","employer_rehabilitation","sickness_benefit"],"must_not_claim":["medical_advice","guaranteed_work_adjustment"],"expected_questions":["q_employment_type","q_work_capacity","q_rehab_plan"],"expected_next_actions":["coordinate_return_to_work_plan","check_benefit_effects"],"risk_flags":["health_sensitive","return_to_work"],"source_requirements":["Försäkringskassan","employer"]},{"case_id":"v02-cancer-edge-3","segment":"cancer","language":"fa","story":"بیماری جدی دارم و فرزند کوچک در خانه است. علاوه بر درآمد، برای حمایت عملی خانواده هم به راهنمایی نیاز داریم.","known_facts":{"actor":"affected","children_at_home":true},"unknown_facts":["children_ages","municipality","support_network","work_status"],"expected_support_areas":["municipal_family_support","sickness_benefit","patient_support"],"must_not_claim":["guaranteed_municipal_service","medical_advice"],"expected_questions":["q_children_ages","q_municipality","q_support_network","q_work_status"],"expected_next_actions":["check_municipal_family_support","check_patient_org_support","check_income_supports"],"risk_flags":["health_sensitive","child_sensitive"],"source_requirements":["kommun","Försäkringskassan","patient_org"]}]}
