{"schema_version":"0.2.0","generated_at":"2026-09-12","purpose":"Synthetic v0.2 benchmark expansion cases for segment foretag with population-first edge cases and sv/ar/fa/en semantic parity.","cases":[{"case_id":"v02-foretag-parity-sv","segment":"foretag","language":"sv","story":"Jag driver ett litet företag och vill investera för att utveckla verksamheten. Jag behöver förstå vilka offentliga stöd eller rådgivningsvägar som kan passa.","known_facts":{"organization":"small_business","goal":"business_investment"},"unknown_facts":["region","company_size","investment_type","budget"],"expected_support_areas":["regional_business_support","business_advisory_support","loan_financing"],"must_not_claim":["guaranteed_business_grant","guaranteed_loan","guaranteed_amount"],"expected_questions":["q_region","q_company_size","q_investment_type","q_budget"],"expected_next_actions":["check_regional_supports","check_business_advice","prepare_investment_case"],"risk_flags":["commercial_risk"],"source_requirements":["region","Tillväxtverket","Almi"]},{"case_id":"v02-foretag-parity-ar","segment":"foretag","language":"ar","story":"أدير شركة صغيرة وأريد الاستثمار لتطوير النشاط. أحتاج إلى فهم ما هي أشكال الدعم العام أو مسارات الإرشاد التي قد تناسبني.","known_facts":{"organization":"small_business","goal":"business_investment"},"unknown_facts":["region","company_size","investment_type","budget"],"expected_support_areas":["regional_business_support","business_advisory_support","loan_financing"],"must_not_claim":["guaranteed_business_grant","guaranteed_loan","guaranteed_amount"],"expected_questions":["q_region","q_company_size","q_investment_type","q_budget"],"expected_next_actions":["check_regional_supports","check_business_advice","prepare_investment_case"],"risk_flags":["commercial_risk"],"source_requirements":["region","Tillväxtverket","Almi"]},{"case_id":"v02-foretag-parity-fa","segment":"foretag","language":"fa","story":"یک شرکت کوچک دارم و می‌خواهم برای توسعه کسب‌وکار سرمایه‌گذاری کنم. می‌خواهم بدانم چه حمایت‌های عمومی یا مسیرهای مشاوره‌ای ممکن است مناسب باشد.","known_facts":{"organization":"small_business","goal":"business_investment"},"unknown_facts":["region","company_size","investment_type","budget"],"expected_support_areas":["regional_business_support","business_advisory_support","loan_financing"],"must_not_claim":["guaranteed_business_grant","guaranteed_loan","guaranteed_amount"],"expected_questions":["q_region","q_company_size","q_investment_type","q_budget"],"expected_next_actions":["check_regional_supports","check_business_advice","prepare_investment_case"],"risk_flags":["commercial_risk"],"source_requirements":["region","Tillväxtverket","Almi"]},{"case_id":"v02-foretag-parity-en","segment":"foretag","language":"en","story":"I run a small business and want to invest to develop it. I need to understand which public support or advisory routes may fit.","known_facts":{"organization":"small_business","goal":"business_investment"},"unknown_facts":["region","company_size","investment_type","budget"],"expected_support_areas":["regional_business_support","business_advisory_support","loan_financing"],"must_not_claim":["guaranteed_business_grant","guaranteed_loan","guaranteed_amount"],"expected_questions":["q_region","q_company_size","q_investment_type","q_budget"],"expected_next_actions":["check_regional_supports","check_business_advice","prepare_investment_case"],"risk_flags":["commercial_risk"],"source_requirements":["region","Tillväxtverket","Almi"]},{"case_id":"v02-foretag-edge-1","segment":"foretag","language":"sv","story":"Mitt företag vill börja sälja till offentlig sektor och vi behöver förstå hur vi hittar upphandlingar och vilka underlag som bör förberedas.","known_facts":{"organization":"small_business","goal":"public_procurement"},"unknown_facts":["services","geography","references","procurement_experience"],"expected_support_areas":["public_procurement_support","business_advisory_support"],"must_not_claim":["guaranteed_contract","legal_procurement_advice_as_binding"],"expected_questions":["q_services","q_geography","q_references","q_procurement_experience"],"expected_next_actions":["find_relevant_procurements","review_basic_procurement_requirements","prepare_evidence_library"],"risk_flags":["procurement_compliance"],"source_requirements":["Upphandlingsmyndigheten","kommun"]},{"case_id":"v02-foretag-edge-2","segment":"foretag","language":"ar","story":"لدي شركة ناشئة بخدمة رقمية وأبحث عن تمويل لاختبار السوق، لكنني لا أريد الخلط بين المنحة والقرض أو اعتبار التمويل مضموناً.","known_facts":{"organization":"startup","goal":"market_validation"},"unknown_facts":["company_age","innovation_level","region","funding_need"],"expected_support_areas":["innovation_funding","regional_business_support","loan_financing"],"must_not_claim":["guaranteed_innovation_grant","guaranteed_loan"],"expected_questions":["q_company_age","q_innovation_level","q_region","q_funding_need"],"expected_next_actions":["check_innovation_programs","check_regional_supports","prepare_validation_plan"],"risk_flags":["commercial_risk"],"source_requirements":["Vinnova","region","Almi"]},{"case_id":"v02-foretag-edge-3","segment":"foretag","language":"fa","story":"یک شرکت کوچک دارم و قصد ورود به بازار صادرات را دارم. قبل از اقدام می‌خواهم مسیرهای مشاوره و حمایت منطقه‌ای را بشناسم.","known_facts":{"organization":"small_business","goal":"export"},"unknown_facts":["target_markets","product_type","company_size"],"expected_support_areas":["export_support","regional_business_support","advisory_support"],"must_not_claim":["guaranteed_export_grant","guaranteed_sales_result"],"expected_questions":["q_target_markets","q_product_type","q_company_size"],"expected_next_actions":["check_export_advisory","check_regional_export_programs"],"risk_flags":["market_risk"],"source_requirements":["Business Sweden","region"]}]}
