{"schema_version":"0.2.0","generated_at":"2026-09-12","purpose":"Synthetic v0.2 benchmark expansion cases for segment villa_energi with population-first edge cases and sv/ar/fa/en semantic parity.","cases":[{"case_id":"v02-villa-energi-parity-sv","segment":"villa_energi","language":"sv","story":"Jag äger en villa och planerar att energieffektivisera. Jag vill förstå skillnaden mellan bidrag, avdrag och kommunal energirådgivning.","known_facts":{"housing":"owned_house","goal":"energy_efficiency"},"unknown_facts":["building_year","planned_measures","heating_system","municipality"],"expected_support_areas":["energy_efficiency_grant","rot_deduction","energy_advice_municipality"],"must_not_claim":["guaranteed_energy_grant","guaranteed_deduction","tax_deduction_compatibility_without_check"],"expected_questions":["q_building_year","q_planned_measures","q_heating_system","q_municipality"],"expected_next_actions":["check_current_energy_grants","check_tax_compatibility","contact_energy_advice"],"risk_flags":["time_limited_program","tax_compatibility"],"source_requirements":["Boverket","Skatteverket","kommun"]},{"case_id":"v02-villa-energi-parity-ar","segment":"villa_energi","language":"ar","story":"أملك منزلاً وأخطط لتحسين كفاءة الطاقة. أريد أن أفهم الفرق بين المنح والخصومات الضريبية وإرشاد الطاقة البلدي.","known_facts":{"housing":"owned_house","goal":"energy_efficiency"},"unknown_facts":["building_year","planned_measures","heating_system","municipality"],"expected_support_areas":["energy_efficiency_grant","rot_deduction","energy_advice_municipality"],"must_not_claim":["guaranteed_energy_grant","guaranteed_deduction","tax_deduction_compatibility_without_check"],"expected_questions":["q_building_year","q_planned_measures","q_heating_system","q_municipality"],"expected_next_actions":["check_current_energy_grants","check_tax_compatibility","contact_energy_advice"],"risk_flags":["time_limited_program","tax_compatibility"],"source_requirements":["Boverket","Skatteverket","kommun"]},{"case_id":"v02-villa-energi-parity-fa","segment":"villa_energi","language":"fa","story":"مالک یک خانه هستم و قصد دارم بهره‌وری انرژی آن را بهتر کنم. می‌خواهم تفاوت کمک‌هزینه، تخفیف مالیاتی و مشاوره انرژی شهرداری را بدانم.","known_facts":{"housing":"owned_house","goal":"energy_efficiency"},"unknown_facts":["building_year","planned_measures","heating_system","municipality"],"expected_support_areas":["energy_efficiency_grant","rot_deduction","energy_advice_municipality"],"must_not_claim":["guaranteed_energy_grant","guaranteed_deduction","tax_deduction_compatibility_without_check"],"expected_questions":["q_building_year","q_planned_measures","q_heating_system","q_municipality"],"expected_next_actions":["check_current_energy_grants","check_tax_compatibility","contact_energy_advice"],"risk_flags":["time_limited_program","tax_compatibility"],"source_requirements":["Boverket","Skatteverket","kommun"]},{"case_id":"v02-villa-energi-parity-en","segment":"villa_energi","language":"en","story":"I own a house and plan to improve its energy efficiency. I want to understand the difference between grants, tax deductions and municipal energy advice.","known_facts":{"housing":"owned_house","goal":"energy_efficiency"},"unknown_facts":["building_year","planned_measures","heating_system","municipality"],"expected_support_areas":["energy_efficiency_grant","rot_deduction","energy_advice_municipality"],"must_not_claim":["guaranteed_energy_grant","guaranteed_deduction","tax_deduction_compatibility_without_check"],"expected_questions":["q_building_year","q_planned_measures","q_heating_system","q_municipality"],"expected_next_actions":["check_current_energy_grants","check_tax_compatibility","contact_energy_advice"],"risk_flags":["time_limited_program","tax_compatibility"],"source_requirements":["Boverket","Skatteverket","kommun"]},{"case_id":"v02-villa-energi-edge-1","segment":"villa_energi","language":"sv","story":"Vi ska byta värmesystem i en äldre villa och vill veta hur energistöd och skatteavdrag kan kombineras utan att anta att allt går samtidigt.","known_facts":{"housing":"owned_house","planned_measure":"heating_system"},"unknown_facts":["current_system","new_system","building_year","installation_timing"],"expected_support_areas":["energy_efficiency_grant","green_technology_deduction","rot_deduction","energy_advice_municipality"],"must_not_claim":["guaranteed_deduction","guaranteed_grant","double_support_compatibility_without_check"],"expected_questions":["q_current_system","q_new_system","q_building_year","q_timing"],"expected_next_actions":["check_current_support_rules","check_tax_deduction_rules","contact_energy_advice"],"risk_flags":["tax_compatibility"],"source_requirements":["Boverket","Skatteverket","kommun"]},{"case_id":"v02-villa-energi-edge-2","segment":"villa_energi","language":"ar","story":"أريد تركيب ألواح شمسية وبطارية في المنزل وأحتاج إلى معرفة القواعد الحالية قبل أن أفترض وجود خصم أو دعم.","known_facts":{"housing":"owned_house","planned_measure":"solar_battery"},"unknown_facts":["ownership","installation_type","contractor"],"expected_support_areas":["green_technology_deduction","energy_advice_municipality"],"must_not_claim":["guaranteed_deduction","guaranteed_amount"],"expected_questions":["q_ownership","q_installation_type","q_contractor"],"expected_next_actions":["check_green_technology_rules","contact_energy_advice"],"risk_flags":["tax_rule_change"],"source_requirements":["Skatteverket","kommun"]},{"case_id":"v02-villa-energi-edge-3","segment":"villa_energi","language":"fa","story":"کودکم از ویلچر استفاده می‌کند و باید ورودی خانه را مناسب‌سازی کنیم. می‌خواهم مسیر کمک مناسب‌سازی مسکن را پیدا کنم.","known_facts":{"housing":"owned_house","need":"accessibility_adaptation"},"unknown_facts":["municipality","functional_need","planned_adaptation"],"expected_support_areas":["housing_adaptation","municipal_support"],"must_not_claim":["guaranteed_housing_adaptation","medical_advice"],"expected_questions":["q_municipality","q_functional_need","q_planned_adaptation"],"expected_next_actions":["check_housing_adaptation_process","collect_required_certificates"],"risk_flags":["health_sensitive","child_sensitive"],"source_requirements":["kommun","Boverket"]}]}
